,Station,Species,DateTimeOriginal,Date,Time,delta.time.secs,delta.time.mins,delta.time.hours,delta.time.days,Directory,FileName,n_images
1,68,Capreolus_capreolus,11/10/2025 08:12,11/10/2025,08:12:43,0,0,0,0,D:/silwood/DSCF/Capreolus_capreolus,04__2025-10-11__08-12-43(1).JPG,2
2,68,Capreolus_capreolus,11/10/2025 09:07,11/10/2025,09:07:50,3307,55.1,0.9,0,D:/silwood/DSCF/Capreolus_capreolus,04__2025-10-11__09-07-50(1).JPG,1
3,68,Capreolus_capreolus,11/10/2025 20:27,11/10/2025,20:27:42,40792,679.9,11.3,0.5,D:/silwood/DSCF/Capreolus_capreolus,04__2025-10-11__20-27-42(3).JPG,7
4,68,Capreolus_capreolus,11/10/2025 20:58,11/10/2025,20:58:46,1864,31.1,0.5,0,D:/silwood/DSCF/Capreolus_capreolus,04__2025-10-11__20-58-46(1).JPG,2
5,68,Capreolus_capreolus,11/10/2025 21:37,11/10/2025,21:37:11,2305,38.4,0.6,0,D:/silwood/DSCF/Capreolus_capreolus,04__2025-10-11__21-37-11(1).JPG,5
6,68,Capreolus_capreolus,11/10/2025 23:29,11/10/2025,23:29:03,6712,111.9,1.9,0.1,D:/silwood/DSCF/Capreolus_capreolus,04__2025-10-11__23-29-03(2).JPG,1
7,68,Capreolus_capreolus,12/10/2025 00:41,12/10/2025,00:41:23,4340,72.3,1.2,0,D:/silwood/DSCF/Capreolus_capreolus,04__2025-10-12__00-41-23(3).JPG,2
8,68,Capreolus_capreolus,12/10/2025 04:52,12/10/2025,04:52:49,15086,251.4,4.2,0.2,D:/silwood/DSCF/Capreolus_capreolus,04__2025-10-12__04-52-49(1).JPG,10
9,68,Capreolus_capreolus,12/10/2025 07:28,12/10/2025,07:28:41,9352,155.9,2.6,0.1,D:/silwood/DSCF/Capreolus_capreolus,04__2025-10-12__07-28-41(1).JPG,2
10,68,Capreolus_capreolus,12/10/2025 19:23,12/10/2025,19:23:51,42910,715.2,11.9,0.5,D:/silwood/DSCF/Capreolus_capreolus,04__2025-10-12__19-23-51(1).JPG,1
11,68,Capreolus_capreolus,12/10/2025 23:43,12/10/2025,23:43:43,15592,259.9,4.3,0.2,D:/silwood/DSCF/Capreolus_capreolus,04__2025-10-12__23-43-43(1).JPG,2
12,68,Capreolus_capreolus,14/10/2025 01:10,14/10/2025,01:10:19,91596,1526.6,25.4,1.1,D:/silwood/DSCF/Capreolus_capreolus,04__2025-10-14__01-10-19(1).JPG,3
13,68,Capreolus_capreolus,14/10/2025 02:29,14/10/2025,02:29:34,4755,79.2,1.3,0.1,D:/silwood/DSCF/Capreolus_capreolus,04__2025-10-14__02-29-34(1).JPG,2
14,68,Capreolus_capreolus,15/10/2025 00:38,15/10/2025,00:38:14,79720,1328.7,22.1,0.9,D:/silwood/DSCF/Capreolus_capreolus,04__2025-10-15__00-38-14(1).JPG,2
15,68,Capreolus_capreolus,15/10/2025 21:13,15/10/2025,21:13:19,74105,1235.1,20.6,0.9,D:/silwood/DSCF/Capreolus_capreolus,04__2025-10-15__21-13-19(1).JPG,1
16,68,Capreolus_capreolus,15/10/2025 22:56,15/10/2025,22:56:25,6186,103.1,1.7,0.1,D:/silwood/DSCF/Capreolus_capreolus,04__2025-10-15__22-56-25(1).JPG,1
17,68,Capreolus_capreolus,16/10/2025 18:46,16/10/2025,18:46:00,71375,1189.6,19.8,0.8,D:/silwood/DSCF/Capreolus_capreolus,04__2025-10-16__18-46-00(1).JPG,3
18,68,Capreolus_capreolus,17/10/2025 07:31,17/10/2025,07:31:22,45922,765.4,12.8,0.5,D:/silwood/DSCF/Capreolus_capreolus,04__2025-10-17__07-31-22(1).JPG,1
19,68,Capreolus_capreolus,17/10/2025 08:07,17/10/2025,08:07:10,2148,35.8,0.6,0,D:/silwood/DSCF/Capreolus_capreolus,04__2025-10-17__08-07-10(1).JPG,1
20,68,Capreolus_capreolus,17/10/2025 18:50,17/10/2025,18:50:23,38593,643.2,10.7,0.4,D:/silwood/DSCF/Capreolus_capreolus,04__2025-10-17__18-50-23(1).JPG,3
21,68,Capreolus_capreolus,18/10/2025 00:25,18/10/2025,00:25:29,20106,335.1,5.6,0.2,D:/silwood/DSCF/Capreolus_capreolus,04__2025-10-18__00-25-29(1).JPG,2
22,68,Capreolus_capreolus,18/10/2025 01:17,18/10/2025,01:17:45,3136,52.3,0.9,0,D:/silwood/DSCF/Capreolus_capreolus,04__2025-10-18__01-17-45(1).JPG,2
23,68,Capreolus_capreolus,19/10/2025 02:26,19/10/2025,02:26:08,90503,1508.4,25.1,1,D:/silwood/DSCF/Capreolus_capreolus,04__2025-10-19__02-26-08(1).JPG,1
24,68,Capreolus_capreolus,23/10/2025 07:46,23/10/2025,07:46:17,364809,6080.1,101.3,4.2,D:/silwood/DSCF/Capreolus_capreolus,04__2025-10-23__07-46-17(1).JPG,1
25,68,Capreolus_capreolus,23/10/2025 09:07,23/10/2025,09:07:48,4891,81.5,1.4,0.1,D:/silwood/DSCF/Capreolus_capreolus,04__2025-10-23__09-07-48(1).JPG,1
26,68,Capreolus_capreolus,23/10/2025 18:21,23/10/2025,18:21:19,33211,553.5,9.2,0.4,D:/silwood/DSCF/Capreolus_capreolus,04__2025-10-23__18-21-19(1).JPG,1
27,68,Capreolus_capreolus,24/10/2025 19:00,24/10/2025,19:00:11,88732,1478.9,24.6,1,D:/silwood/DSCF/Capreolus_capreolus,04__2025-10-24__19-00-11(1).JPG,6
28,68,Capreolus_capreolus,25/10/2025 09:33,25/10/2025,09:33:37,52406,873.4,14.6,0.6,D:/silwood/DSCF/Capreolus_capreolus,04__2025-10-25__09-33-37(2).JPG,1
29,68,Capreolus_capreolus,25/10/2025 18:33,25/10/2025,18:33:37,32400,540,9,0.4,D:/silwood/DSCF/Capreolus_capreolus,04__2025-10-25__18-33-37(1).JPG,7
30,68,Capreolus_capreolus,28/10/2025 08:49,28/10/2025,08:49:15,224138,3735.6,62.3,2.6,D:/silwood/DSCF/Capreolus_capreolus,04__2025-10-28__08-49-15(1).JPG,1
31,68,Capreolus_capreolus,28/10/2025 15:14,28/10/2025,15:14:14,23099,385,6.4,0.3,D:/silwood/DSCF/Capreolus_capreolus,04__2025-10-28__15-14-14(1).JPG,4
32,68,Capreolus_capreolus,28/10/2025 20:35,28/10/2025,20:35:05,19251,320.9,5.3,0.2,D:/silwood/DSCF/Capreolus_capreolus,04__2025-10-28__20-35-05(2).JPG,1
33,68,Capreolus_capreolus,30/10/2025 12:49,30/10/2025,12:49:28,144863,2414.4,40.2,1.7,D:/silwood/DSCF/Capreolus_capreolus,04__2025-10-30__12-49-28(1).JPG,2
34,68,Capreolus_capreolus,31/10/2025 04:23,31/10/2025,04:23:13,56025,933.8,15.6,0.7,D:/silwood/DSCF/Capreolus_capreolus,04__2025-10-31__04-23-13(1).JPG,2
35,68,Capreolus_capreolus,31/10/2025 09:26,31/10/2025,09:26:22,18189,303.1,5.1,0.2,D:/silwood/DSCF/Capreolus_capreolus,04__2025-10-31__09-26-22(1).JPG,1
36,68,Capreolus_capreolus,02/11/2025 18:45,02/11/2025,18:45:37,206355,3439.2,57.3,2.4,D:/silwood/DSCF/Capreolus_capreolus,04__2025-11-02__18-45-37(1).JPG,3
37,68,Capreolus_capreolus,06/11/2025 01:21,06/11/2025,01:21:22,282945,4715.8,78.6,3.3,D:/silwood/DSCF/Capreolus_capreolus,04__2025-11-06__01-21-22(2).JPG,8
38,68,Capreolus_capreolus,09/11/2025 21:35,09/11/2025,21:35:36,332054,5534.2,92.2,3.8,D:/silwood/DSCF/Capreolus_capreolus,04__2025-11-09__21-35-36(1).JPG,5
39,68,Capreolus_capreolus,10/11/2025 09:06,10/11/2025,09:06:04,41428,690.5,11.5,0.5,D:/silwood/DSCF/Capreolus_capreolus,04__2025-11-10__09-06-04(1).JPG,2
40,68,Capreolus_capreolus,17/11/2025 09:36,17/11/2025,09:36:41,606637,10110.6,168.5,7,D:/silwood/DSCF/Capreolus_capreolus,04__2025-11-17__09-36-41(1).JPG,1
41,68,Capreolus_capreolus,21/11/2025 17:34,21/11/2025,17:34:51,374290,6238.2,104,4.3,D:/silwood/DSCF/Capreolus_capreolus,04__2025-11-21__17-34-51(1).JPG,2
42,68,Columba_palumbus,16/11/2025 12:52,16/11/2025,12:52:56,0,0,0,0,D:/silwood/DSCF/Columba_palumbus,04__2025-11-16__12-52-56(1).JPG,3
43,68,Columba_palumbus,17/11/2025 10:10,17/11/2025,10:10:00,76624,1277.1,21.3,0.9,D:/silwood/DSCF/Columba_palumbus,04__2025-11-17__10-10-00(1).JPG,2
44,68,Columba_palumbus,21/11/2025 14:32,21/11/2025,14:32:23,361343,6022.4,100.4,4.2,D:/silwood/DSCF/Columba_palumbus,04__2025-11-21__14-32-23(1).JPG,4
45,68,Columba_palumbus,23/11/2025 15:11,23/11/2025,15:11:52,175169,2919.5,48.7,2,D:/silwood/DSCF/Columba_palumbus,04__2025-11-23__15-11-52(1).JPG,3
46,68,Garrulus_glandarius,21/11/2025 14:24,21/11/2025,14:24:34,0,0,0,0,D:/silwood/DSCF/Garrulus_glandarius,04__2025-11-21__14-24-34(1).JPG,1
47,68,Homo_sapiens,20/06/2025 12:00,20/06/2025,12:00:19,0,0,0,0,D:/silwood/DSCF/Homo_sapiens,04__2025-06-20__12-00-19(1).JPG,3
48,68,Homo_sapiens,08/10/2025 11:07,08/10/2025,11:07:41,9500842,158347.4,2639.1,110,D:/silwood/DSCF/Homo_sapiens,04__2025-10-08__11-07-41(1).JPG,3
49,68,Homo_sapiens,02/11/2025 10:41,02/11/2025,10:41:39,2158438,35974,599.6,25,D:/silwood/DSCF/Homo_sapiens,04__2025-11-02__10-41-39(1).JPG,1
50,68,Homo_sapiens,24/11/2025 11:04,24/11/2025,11:04:37,1902178,31703,528.4,22,D:/silwood/DSCF/Homo_sapiens,04__2025-11-24__11-04-37(1).JPG,2
51,68,Muntiacus_reevesi,09/10/2025 01:23,09/10/2025,01:23:52,0,0,0,0,D:/silwood/DSCF/Muntiacus_reevesi,04__2025-10-09__01-23-52(1).JPG,2
52,68,Muntiacus_reevesi,09/10/2025 03:28,09/10/2025,03:28:22,7470,124.5,2.1,0.1,D:/silwood/DSCF/Muntiacus_reevesi,04__2025-10-09__03-28-22(1).JPG,2
53,68,Muntiacus_reevesi,10/10/2025 08:15,10/10/2025,08:15:24,103622,1727,28.8,1.2,D:/silwood/DSCF/Muntiacus_reevesi,04__2025-10-10__08-15-24(1).JPG,1
54,68,Muntiacus_reevesi,10/10/2025 12:01,10/10/2025,12:01:50,13586,226.4,3.8,0.2,D:/silwood/DSCF/Muntiacus_reevesi,04__2025-10-10__12-01-50(1).JPG,1
55,68,Muntiacus_reevesi,11/10/2025 07:37,11/10/2025,07:37:04,70514,1175.2,19.6,0.8,D:/silwood/DSCF/Muntiacus_reevesi,04__2025-10-11__07-37-04(1).JPG,1
56,68,Muntiacus_reevesi,12/10/2025 07:07,12/10/2025,07:07:50,84646,1410.8,23.5,1,D:/silwood/DSCF/Muntiacus_reevesi,04__2025-10-12__07-07-50(1).JPG,2
57,68,Muntiacus_reevesi,12/10/2025 08:04,12/10/2025,08:04:07,3377,56.3,0.9,0,D:/silwood/DSCF/Muntiacus_reevesi,04__2025-10-12__08-04-07(1).JPG,2
58,68,Muntiacus_reevesi,12/10/2025 18:23,12/10/2025,18:23:19,37152,619.2,10.3,0.4,D:/silwood/DSCF/Muntiacus_reevesi,04__2025-10-12__18-23-19(1).JPG,1
59,68,Muntiacus_reevesi,14/10/2025 02:35,14/10/2025,02:35:21,115922,1932,32.2,1.3,D:/silwood/DSCF/Muntiacus_reevesi,04__2025-10-14__02-35-21(3).JPG,2
60,68,Muntiacus_reevesi,14/10/2025 07:21,14/10/2025,07:21:09,17148,285.8,4.8,0.2,D:/silwood/DSCF/Muntiacus_reevesi,04__2025-10-14__07-21-09(1).JPG,1
61,68,Muntiacus_reevesi,14/10/2025 18:30,14/10/2025,18:30:56,40187,669.8,11.2,0.5,D:/silwood/DSCF/Muntiacus_reevesi,04__2025-10-14__18-30-56(1).JPG,2
62,68,Muntiacus_reevesi,14/10/2025 22:16,14/10/2025,22:16:15,13519,225.3,3.8,0.2,D:/silwood/DSCF/Muntiacus_reevesi,04__2025-10-14__22-16-15(1).JPG,2
63,68,Muntiacus_reevesi,14/10/2025 23:04,14/10/2025,23:04:34,2899,48.3,0.8,0,D:/silwood/DSCF/Muntiacus_reevesi,04__2025-10-14__23-04-34(1).JPG,1
64,68,Muntiacus_reevesi,15/10/2025 01:30,15/10/2025,01:30:50,8776,146.3,2.4,0.1,D:/silwood/DSCF/Muntiacus_reevesi,04__2025-10-15__01-30-50(1).JPG,2
65,68,Muntiacus_reevesi,15/10/2025 18:12,15/10/2025,18:12:25,60095,1001.6,16.7,0.7,D:/silwood/DSCF/Muntiacus_reevesi,04__2025-10-15__18-12-25(1).JPG,4
66,68,Muntiacus_reevesi,15/10/2025 20:04,15/10/2025,20:04:21,6716,111.9,1.9,0.1,D:/silwood/DSCF/Muntiacus_reevesi,04__2025-10-15__20-04-21(1).JPG,2
67,68,Muntiacus_reevesi,16/10/2025 07:18,16/10/2025,07:18:35,40454,674.2,11.2,0.5,D:/silwood/DSCF/Muntiacus_reevesi,04__2025-10-16__07-18-35(1).JPG,1
68,68,Muntiacus_reevesi,16/10/2025 13:50,16/10/2025,13:50:38,23523,392,6.5,0.3,D:/silwood/DSCF/Muntiacus_reevesi,04__2025-10-16__13-50-38(1).JPG,2
69,68,Muntiacus_reevesi,17/10/2025 04:21,17/10/2025,04:21:32,52254,870.9,14.5,0.6,D:/silwood/DSCF/Muntiacus_reevesi,04__2025-10-17__04-21-32(1).JPG,1
70,68,Muntiacus_reevesi,17/10/2025 09:59,17/10/2025,09:59:25,20273,337.9,5.6,0.2,D:/silwood/DSCF/Muntiacus_reevesi,04__2025-10-17__09-59-25(1).JPG,2
71,68,Muntiacus_reevesi,18/10/2025 08:17,18/10/2025,08:17:11,80266,1337.8,22.3,0.9,D:/silwood/DSCF/Muntiacus_reevesi,04__2025-10-18__08-17-11(1).JPG,2
72,68,Muntiacus_reevesi,18/10/2025 20:30,18/10/2025,20:30:04,43973,732.9,12.2,0.5,D:/silwood/DSCF/Muntiacus_reevesi,04__2025-10-18__20-30-04(1).JPG,1
73,68,Muntiacus_reevesi,19/10/2025 06:46,19/10/2025,06:46:37,36993,616.5,10.3,0.4,D:/silwood/DSCF/Muntiacus_reevesi,04__2025-10-19__06-46-37(1).JPG,2
74,68,Muntiacus_reevesi,19/10/2025 17:28,19/10/2025,17:28:09,38492,641.5,10.7,0.4,D:/silwood/DSCF/Muntiacus_reevesi,04__2025-10-19__17-28-09(2).JPG,1
75,68,Muntiacus_reevesi,20/10/2025 21:38,20/10/2025,21:38:21,101412,1690.2,28.2,1.2,D:/silwood/DSCF/Muntiacus_reevesi,04__2025-10-20__21-38-21(1).JPG,1
76,68,Muntiacus_reevesi,20/10/2025 22:28,20/10/2025,22:28:57,3036,50.6,0.8,0,D:/silwood/DSCF/Muntiacus_reevesi,04__2025-10-20__22-28-57(1).JPG,1
77,68,Muntiacus_reevesi,21/10/2025 21:48,21/10/2025,21:48:57,84000,1400,23.3,1,D:/silwood/DSCF/Muntiacus_reevesi,04__2025-10-21__21-48-57(1).JPG,1
78,68,Muntiacus_reevesi,22/10/2025 07:46,22/10/2025,07:46:12,35835,597.2,10,0.4,D:/silwood/DSCF/Muntiacus_reevesi,04__2025-10-22__07-46-12(1).JPG,1
79,68,Muntiacus_reevesi,22/10/2025 10:18,22/10/2025,10:18:25,9133,152.2,2.5,0.1,D:/silwood/DSCF/Muntiacus_reevesi,04__2025-10-22__10-18-25(1).JPG,3
80,68,Muntiacus_reevesi,22/10/2025 13:13,22/10/2025,13:13:12,10487,174.8,2.9,0.1,D:/silwood/DSCF/Muntiacus_reevesi,04__2025-10-22__13-13-12(1).JPG,2
81,68,Muntiacus_reevesi,23/10/2025 02:22,23/10/2025,02:22:43,47371,789.5,13.2,0.5,D:/silwood/DSCF/Muntiacus_reevesi,04__2025-10-23__02-22-43(1).JPG,1
82,68,Muntiacus_reevesi,23/10/2025 18:16,23/10/2025,18:16:35,57232,953.9,15.9,0.7,D:/silwood/DSCF/Muntiacus_reevesi,04__2025-10-23__18-16-35(2).JPG,2
83,68,Muntiacus_reevesi,24/10/2025 18:16,24/10/2025,18:16:28,86393,1439.9,24,1,D:/silwood/DSCF/Muntiacus_reevesi,04__2025-10-24__18-16-28(1).JPG,1
84,68,Muntiacus_reevesi,25/10/2025 03:06,25/10/2025,03:06:32,31804,530.1,8.8,0.4,D:/silwood/DSCF/Muntiacus_reevesi,04__2025-10-25__03-06-32(2).JPG,3
85,68,Muntiacus_reevesi,25/10/2025 09:31,25/10/2025,09:31:29,23097,385,6.4,0.3,D:/silwood/DSCF/Muntiacus_reevesi,04__2025-10-25__09-31-29(2).JPG,2
86,68,Muntiacus_reevesi,25/10/2025 18:03,25/10/2025,18:03:43,30734,512.2,8.5,0.4,D:/silwood/DSCF/Muntiacus_reevesi,04__2025-10-25__18-03-43(2).JPG,2
87,68,Muntiacus_reevesi,25/10/2025 18:46,25/10/2025,18:46:27,2564,42.7,0.7,0,D:/silwood/DSCF/Muntiacus_reevesi,04__2025-10-25__18-46-27(1).JPG,1
88,68,Muntiacus_reevesi,25/10/2025 23:59,25/10/2025,23:59:59,18812,313.5,5.2,0.2,D:/silwood/DSCF/Muntiacus_reevesi,04__2025-10-25__23-59-59(1).JPG,2
89,68,Muntiacus_reevesi,26/10/2025 18:24,26/10/2025,18:24:53,66294,1104.9,18.4,0.8,D:/silwood/DSCF/Muntiacus_reevesi,04__2025-10-26__18-24-53(1).JPG,1
90,68,Muntiacus_reevesi,27/10/2025 05:30,27/10/2025,05:30:49,39956,665.9,11.1,0.5,D:/silwood/DSCF/Muntiacus_reevesi,04__2025-10-27__05-30-49(2).JPG,1
91,68,Muntiacus_reevesi,27/10/2025 07:00,27/10/2025,07:00:18,5369,89.5,1.5,0.1,D:/silwood/DSCF/Muntiacus_reevesi,04__2025-10-27__07-00-18(1).JPG,1
92,68,Muntiacus_reevesi,27/10/2025 18:22,27/10/2025,18:22:36,40938,682.3,11.4,0.5,D:/silwood/DSCF/Muntiacus_reevesi,04__2025-10-27__18-22-36(1).JPG,1
93,68,Muntiacus_reevesi,28/10/2025 20:32,28/10/2025,20:32:34,94198,1570,26.2,1.1,D:/silwood/DSCF/Muntiacus_reevesi,04__2025-10-28__20-32-34(1).JPG,3
94,68,Muntiacus_reevesi,28/10/2025 23:52,28/10/2025,23:52:48,12014,200.2,3.3,0.1,D:/silwood/DSCF/Muntiacus_reevesi,04__2025-10-28__23-52-48(1).JPG,1
95,68,Muntiacus_reevesi,30/10/2025 07:54,30/10/2025,07:54:03,115275,1921.2,32,1.3,D:/silwood/DSCF/Muntiacus_reevesi,04__2025-10-30__07-54-03(2).JPG,3
96,68,Muntiacus_reevesi,30/10/2025 09:05,30/10/2025,09:05:49,4306,71.8,1.2,0,D:/silwood/DSCF/Muntiacus_reevesi,04__2025-10-30__09-05-49(3).JPG,1
97,68,Muntiacus_reevesi,30/10/2025 09:53,30/10/2025,09:53:31,2862,47.7,0.8,0,D:/silwood/DSCF/Muntiacus_reevesi,04__2025-10-30__09-53-31(1).JPG,1
98,68,Muntiacus_reevesi,30/10/2025 16:45,30/10/2025,16:45:23,24712,411.9,6.9,0.3,D:/silwood/DSCF/Muntiacus_reevesi,04__2025-10-30__16-45-23(3).JPG,2
99,68,Muntiacus_reevesi,30/10/2025 20:32,30/10/2025,20:32:22,13619,227,3.8,0.2,D:/silwood/DSCF/Muntiacus_reevesi,04__2025-10-30__20-32-22(1).JPG,2
100,68,Muntiacus_reevesi,30/10/2025 22:51,30/10/2025,22:51:28,8346,139.1,2.3,0.1,D:/silwood/DSCF/Muntiacus_reevesi,04__2025-10-30__22-51-28(3).JPG,1
101,68,Muntiacus_reevesi,30/10/2025 23:43,30/10/2025,23:43:52,3144,52.4,0.9,0,D:/silwood/DSCF/Muntiacus_reevesi,04__2025-10-30__23-43-52(1).JPG,1
102,68,Muntiacus_reevesi,31/10/2025 07:16,31/10/2025,07:16:59,27187,453.1,7.6,0.3,D:/silwood/DSCF/Muntiacus_reevesi,04__2025-10-31__07-16-59(1).JPG,1
103,68,Muntiacus_reevesi,31/10/2025 07:58,31/10/2025,07:58:39,2500,41.7,0.7,0,D:/silwood/DSCF/Muntiacus_reevesi,04__2025-10-31__07-58-39(1).JPG,3
104,68,Muntiacus_reevesi,31/10/2025 09:21,31/10/2025,09:21:15,4956,82.6,1.4,0.1,D:/silwood/DSCF/Muntiacus_reevesi,04__2025-10-31__09-21-15(2).JPG,2
105,68,Muntiacus_reevesi,01/11/2025 00:36,01/11/2025,00:36:51,54936,915.6,15.3,0.6,D:/silwood/DSCF/Muntiacus_reevesi,04__2025-11-01__00-36-51(1).JPG,1
106,68,Muntiacus_reevesi,01/11/2025 04:16,01/11/2025,04:16:51,13200,220,3.7,0.2,D:/silwood/DSCF/Muntiacus_reevesi,04__2025-11-01__04-16-51(1).JPG,3
107,68,Muntiacus_reevesi,01/11/2025 07:45,01/11/2025,07:45:35,12524,208.7,3.5,0.1,D:/silwood/DSCF/Muntiacus_reevesi,04__2025-11-01__07-45-35(1).JPG,2
108,68,Muntiacus_reevesi,01/11/2025 08:29,01/11/2025,08:29:01,2606,43.4,0.7,0,D:/silwood/DSCF/Muntiacus_reevesi,04__2025-11-01__08-29-01(1).JPG,1
109,68,Muntiacus_reevesi,01/11/2025 22:46,01/11/2025,22:46:15,51434,857.2,14.3,0.6,D:/silwood/DSCF/Muntiacus_reevesi,04__2025-11-01__22-46-15(1).JPG,1
110,68,Muntiacus_reevesi,02/11/2025 05:33,02/11/2025,05:33:47,24452,407.5,6.8,0.3,D:/silwood/DSCF/Muntiacus_reevesi,04__2025-11-02__05-33-47(1).JPG,2
111,68,Muntiacus_reevesi,02/11/2025 08:30,02/11/2025,08:30:06,10579,176.3,2.9,0.1,D:/silwood/DSCF/Muntiacus_reevesi,04__2025-11-02__08-30-06(1).JPG,3
112,68,Muntiacus_reevesi,02/11/2025 09:08,02/11/2025,09:08:42,2316,38.6,0.6,0,D:/silwood/DSCF/Muntiacus_reevesi,04__2025-11-02__09-08-42(1).JPG,3
113,68,Muntiacus_reevesi,02/11/2025 17:58,02/11/2025,17:58:39,31797,530,8.8,0.4,D:/silwood/DSCF/Muntiacus_reevesi,04__2025-11-02__17-58-39(1).JPG,2
114,68,Muntiacus_reevesi,02/11/2025 19:09,02/11/2025,19:09:42,4263,71,1.2,0,D:/silwood/DSCF/Muntiacus_reevesi,04__2025-11-02__19-09-42(1).JPG,1
115,68,Muntiacus_reevesi,02/11/2025 23:06,02/11/2025,23:06:38,14216,236.9,3.9,0.2,D:/silwood/DSCF/Muntiacus_reevesi,04__2025-11-02__23-06-38(1).JPG,5
116,68,Muntiacus_reevesi,03/11/2025 04:31,03/11/2025,04:31:13,19475,324.6,5.4,0.2,D:/silwood/DSCF/Muntiacus_reevesi,04__2025-11-03__04-31-13(1).JPG,2
117,68,Muntiacus_reevesi,03/11/2025 05:04,03/11/2025,05:04:08,1975,32.9,0.5,0,D:/silwood/DSCF/Muntiacus_reevesi,04__2025-11-03__05-04-08(1).JPG,1
118,68,Muntiacus_reevesi,03/11/2025 06:51,03/11/2025,06:51:23,6435,107.2,1.8,0.1,D:/silwood/DSCF/Muntiacus_reevesi,04__2025-11-03__06-51-23(1).JPG,1
119,68,Muntiacus_reevesi,04/11/2025 00:21,04/11/2025,00:21:47,63024,1050.4,17.5,0.7,D:/silwood/DSCF/Muntiacus_reevesi,04__2025-11-04__00-21-47(1).JPG,2
120,68,Muntiacus_reevesi,05/11/2025 06:56,05/11/2025,06:56:51,110104,1835.1,30.6,1.3,D:/silwood/DSCF/Muntiacus_reevesi,04__2025-11-05__06-56-51(1).JPG,2
121,68,Muntiacus_reevesi,05/11/2025 07:40,05/11/2025,07:40:15,2604,43.4,0.7,0,D:/silwood/DSCF/Muntiacus_reevesi,04__2025-11-05__07-40-15(1).JPG,1
122,68,Muntiacus_reevesi,05/11/2025 08:19,05/11/2025,08:19:47,2372,39.5,0.7,0,D:/silwood/DSCF/Muntiacus_reevesi,04__2025-11-05__08-19-47(1).JPG,8
123,68,Muntiacus_reevesi,05/11/2025 09:02,05/11/2025,09:02:52,2585,43.1,0.7,0,D:/silwood/DSCF/Muntiacus_reevesi,04__2025-11-05__09-02-52(1).JPG,1
124,68,Muntiacus_reevesi,05/11/2025 18:27,05/11/2025,18:27:17,33865,564.4,9.4,0.4,D:/silwood/DSCF/Muntiacus_reevesi,04__2025-11-05__18-27-17(1).JPG,1
125,68,Muntiacus_reevesi,05/11/2025 19:12,05/11/2025,19:12:52,2735,45.6,0.8,0,D:/silwood/DSCF/Muntiacus_reevesi,04__2025-11-05__19-12-52(1).JPG,2
126,68,Muntiacus_reevesi,05/11/2025 23:37,05/11/2025,23:37:47,15895,264.9,4.4,0.2,D:/silwood/DSCF/Muntiacus_reevesi,04__2025-11-05__23-37-47(1).JPG,3
127,68,Muntiacus_reevesi,06/11/2025 02:52,06/11/2025,02:52:59,11712,195.2,3.3,0.1,D:/silwood/DSCF/Muntiacus_reevesi,04__2025-11-06__02-52-59(1).JPG,7
128,68,Muntiacus_reevesi,06/11/2025 17:31,06/11/2025,17:31:21,52702,878.4,14.6,0.6,D:/silwood/DSCF/Muntiacus_reevesi,04__2025-11-06__17-31-21(1).JPG,2
129,68,Muntiacus_reevesi,06/11/2025 18:04,06/11/2025,18:04:46,2005,33.4,0.6,0,D:/silwood/DSCF/Muntiacus_reevesi,04__2025-11-06__18-04-46(1).JPG,2
130,68,Muntiacus_reevesi,07/11/2025 02:27,07/11/2025,02:27:08,30142,502.4,8.4,0.4,D:/silwood/DSCF/Muntiacus_reevesi,04__2025-11-07__02-27-08(1).JPG,2
131,68,Muntiacus_reevesi,07/11/2025 17:39,07/11/2025,17:39:37,54749,912.5,15.2,0.6,D:/silwood/DSCF/Muntiacus_reevesi,04__2025-11-07__17-39-37(1).JPG,2
132,68,Muntiacus_reevesi,07/11/2025 19:45,07/11/2025,19:45:08,7531,125.5,2.1,0.1,D:/silwood/DSCF/Muntiacus_reevesi,04__2025-11-07__19-45-08(1).JPG,1
133,68,Muntiacus_reevesi,07/11/2025 22:38,07/11/2025,22:38:20,10392,173.2,2.9,0.1,D:/silwood/DSCF/Muntiacus_reevesi,04__2025-11-07__22-38-20(1).JPG,9
134,68,Muntiacus_reevesi,08/11/2025 01:09,08/11/2025,01:09:37,9077,151.3,2.5,0.1,D:/silwood/DSCF/Muntiacus_reevesi,04__2025-11-08__01-09-37(2).JPG,1
135,68,Muntiacus_reevesi,08/11/2025 02:43,08/11/2025,02:43:38,5641,94,1.6,0.1,D:/silwood/DSCF/Muntiacus_reevesi,04__2025-11-08__02-43-38(1).JPG,2
136,68,Muntiacus_reevesi,08/11/2025 07:12,08/11/2025,07:12:44,16146,269.1,4.5,0.2,D:/silwood/DSCF/Muntiacus_reevesi,04__2025-11-08__07-12-44(3).JPG,1
137,68,Muntiacus_reevesi,08/11/2025 07:44,08/11/2025,07:44:44,1920,32,0.5,0,D:/silwood/DSCF/Muntiacus_reevesi,04__2025-11-08__07-44-44(1).JPG,2
138,68,Muntiacus_reevesi,08/11/2025 08:23,08/11/2025,08:23:00,2296,38.3,0.6,0,D:/silwood/DSCF/Muntiacus_reevesi,04__2025-11-08__08-23-00(1).JPG,6
139,68,Muntiacus_reevesi,08/11/2025 17:43,08/11/2025,17:43:33,33633,560.5,9.3,0.4,D:/silwood/DSCF/Muntiacus_reevesi,04__2025-11-08__17-43-33(1).JPG,6
140,68,Muntiacus_reevesi,08/11/2025 23:17,08/11/2025,23:17:39,20046,334.1,5.6,0.2,D:/silwood/DSCF/Muntiacus_reevesi,04__2025-11-08__23-17-39(1).JPG,2
141,68,Muntiacus_reevesi,09/11/2025 01:28,09/11/2025,01:28:19,7840,130.7,2.2,0.1,D:/silwood/DSCF/Muntiacus_reevesi,04__2025-11-09__01-28-19(1).JPG,4
142,68,Muntiacus_reevesi,09/11/2025 02:00,09/11/2025,02:00:28,1929,32.1,0.5,0,D:/silwood/DSCF/Muntiacus_reevesi,04__2025-11-09__02-00-28(1).JPG,2
143,68,Muntiacus_reevesi,09/11/2025 04:42,09/11/2025,04:42:52,9744,162.4,2.7,0.1,D:/silwood/DSCF/Muntiacus_reevesi,04__2025-11-09__04-42-52(2).JPG,2
144,68,Muntiacus_reevesi,09/11/2025 09:18,09/11/2025,09:18:15,16523,275.4,4.6,0.2,D:/silwood/DSCF/Muntiacus_reevesi,04__2025-11-09__09-18-15(1).JPG,4
145,68,Muntiacus_reevesi,09/11/2025 11:23,09/11/2025,11:23:16,7501,125,2.1,0.1,D:/silwood/DSCF/Muntiacus_reevesi,04__2025-11-09__11-23-16(1).JPG,2
146,68,Muntiacus_reevesi,09/11/2025 20:00,09/11/2025,20:00:40,31044,517.4,8.6,0.4,D:/silwood/DSCF/Muntiacus_reevesi,04__2025-11-09__20-00-40(1).JPG,3
147,68,Muntiacus_reevesi,09/11/2025 21:03,09/11/2025,21:03:12,3752,62.5,1,0,D:/silwood/DSCF/Muntiacus_reevesi,04__2025-11-09__21-03-12(1).JPG,4
148,68,Muntiacus_reevesi,10/11/2025 03:19,10/11/2025,03:19:42,22590,376.5,6.3,0.3,D:/silwood/DSCF/Muntiacus_reevesi,04__2025-11-10__03-19-42(1).JPG,4
149,68,Muntiacus_reevesi,10/11/2025 04:09,10/11/2025,04:09:40,2998,50,0.8,0,D:/silwood/DSCF/Muntiacus_reevesi,04__2025-11-10__04-09-40(1).JPG,1
150,68,Muntiacus_reevesi,10/11/2025 06:51,10/11/2025,06:51:12,9692,161.5,2.7,0.1,D:/silwood/DSCF/Muntiacus_reevesi,04__2025-11-10__06-51-12(1).JPG,15
151,68,Muntiacus_reevesi,10/11/2025 07:21,10/11/2025,07:21:50,1838,30.6,0.5,0,D:/silwood/DSCF/Muntiacus_reevesi,04__2025-11-10__07-21-50(1).JPG,1
152,68,Muntiacus_reevesi,10/11/2025 08:10,10/11/2025,08:10:11,2901,48.4,0.8,0,D:/silwood/DSCF/Muntiacus_reevesi,04__2025-11-10__08-10-11(1).JPG,1
153,68,Muntiacus_reevesi,10/11/2025 09:58,10/11/2025,09:58:19,6488,108.1,1.8,0.1,D:/silwood/DSCF/Muntiacus_reevesi,04__2025-11-10__09-58-19(2).JPG,1
154,68,Muntiacus_reevesi,10/11/2025 22:41,10/11/2025,22:41:09,45770,762.8,12.7,0.5,D:/silwood/DSCF/Muntiacus_reevesi,04__2025-11-10__22-41-09(1).JPG,2
155,68,Muntiacus_reevesi,11/11/2025 01:52,11/11/2025,01:52:00,11451,190.8,3.2,0.1,D:/silwood/DSCF/Muntiacus_reevesi,04__2025-11-11__01-52-00(1).JPG,3
156,68,Muntiacus_reevesi,11/11/2025 17:03,11/11/2025,17:03:39,54699,911.6,15.2,0.6,D:/silwood/DSCF/Muntiacus_reevesi,04__2025-11-11__17-03-39(1).JPG,1
157,68,Muntiacus_reevesi,11/11/2025 18:03,11/11/2025,18:03:41,3602,60,1,0,D:/silwood/DSCF/Muntiacus_reevesi,04__2025-11-11__18-03-41(1).JPG,2
158,68,Muntiacus_reevesi,11/11/2025 19:32,11/11/2025,19:32:06,5305,88.4,1.5,0.1,D:/silwood/DSCF/Muntiacus_reevesi,04__2025-11-11__19-32-06(1).JPG,2
159,68,Muntiacus_reevesi,11/11/2025 21:31,11/11/2025,21:31:27,7161,119.3,2,0.1,D:/silwood/DSCF/Muntiacus_reevesi,04__2025-11-11__21-31-27(1).JPG,1
160,68,Muntiacus_reevesi,11/11/2025 23:25,11/11/2025,23:25:09,6822,113.7,1.9,0.1,D:/silwood/DSCF/Muntiacus_reevesi,04__2025-11-11__23-25-09(1).JPG,1
161,68,Muntiacus_reevesi,12/11/2025 07:58,12/11/2025,07:58:55,30826,513.8,8.6,0.4,D:/silwood/DSCF/Muntiacus_reevesi,04__2025-11-12__07-58-55(1).JPG,7
162,68,Muntiacus_reevesi,12/11/2025 08:32,12/11/2025,08:32:58,2043,34,0.6,0,D:/silwood/DSCF/Muntiacus_reevesi,04__2025-11-12__08-32-58(1).JPG,2
163,68,Muntiacus_reevesi,12/11/2025 09:03,12/11/2025,09:03:46,1848,30.8,0.5,0,D:/silwood/DSCF/Muntiacus_reevesi,04__2025-11-12__09-03-46(1).JPG,2
164,68,Muntiacus_reevesi,13/11/2025 01:30,13/11/2025,01:30:10,59184,986.4,16.4,0.7,D:/silwood/DSCF/Muntiacus_reevesi,04__2025-11-13__01-30-10(1).JPG,1
165,68,Muntiacus_reevesi,13/11/2025 02:19,13/11/2025,02:19:29,2959,49.3,0.8,0,D:/silwood/DSCF/Muntiacus_reevesi,04__2025-11-13__02-19-29(1).JPG,2
166,68,Muntiacus_reevesi,13/11/2025 05:52,13/11/2025,05:52:24,12775,212.9,3.5,0.1,D:/silwood/DSCF/Muntiacus_reevesi,04__2025-11-13__05-52-24(1).JPG,4
167,68,Muntiacus_reevesi,13/11/2025 07:10,13/11/2025,07:10:18,4674,77.9,1.3,0.1,D:/silwood/DSCF/Muntiacus_reevesi,04__2025-11-13__07-10-18(1).JPG,1
168,68,Muntiacus_reevesi,13/11/2025 07:49,13/11/2025,07:49:21,2343,39,0.7,0,D:/silwood/DSCF/Muntiacus_reevesi,04__2025-11-13__07-49-21(1).JPG,2
169,68,Muntiacus_reevesi,13/11/2025 09:02,13/11/2025,09:02:40,4399,73.3,1.2,0,D:/silwood/DSCF/Muntiacus_reevesi,04__2025-11-13__09-02-40(1).JPG,2
170,68,Muntiacus_reevesi,13/11/2025 23:09,13/11/2025,23:09:38,50818,847,14.1,0.6,D:/silwood/DSCF/Muntiacus_reevesi,04__2025-11-13__23-09-38(1).JPG,1
171,68,Muntiacus_reevesi,14/11/2025 04:03,14/11/2025,04:03:32,17634,293.9,4.9,0.2,D:/silwood/DSCF/Muntiacus_reevesi,04__2025-11-14__04-03-32(3).JPG,1
172,68,Muntiacus_reevesi,14/11/2025 05:15,14/11/2025,05:15:48,4336,72.3,1.2,0,D:/silwood/DSCF/Muntiacus_reevesi,04__2025-11-14__05-15-48(1).JPG,1
173,68,Muntiacus_reevesi,14/11/2025 08:00,14/11/2025,08:00:26,9878,164.6,2.7,0.1,D:/silwood/DSCF/Muntiacus_reevesi,04__2025-11-14__08-00-26(1).JPG,2
174,68,Muntiacus_reevesi,14/11/2025 09:06,14/11/2025,09:06:35,3969,66.2,1.1,0,D:/silwood/DSCF/Muntiacus_reevesi,04__2025-11-14__09-06-35(1).JPG,2
175,68,Muntiacus_reevesi,14/11/2025 18:01,14/11/2025,18:01:31,32096,534.9,8.9,0.4,D:/silwood/DSCF/Muntiacus_reevesi,04__2025-11-14__18-01-31(1).JPG,2
176,68,Muntiacus_reevesi,14/11/2025 19:48,14/11/2025,19:48:37,6426,107.1,1.8,0.1,D:/silwood/DSCF/Muntiacus_reevesi,04__2025-11-14__19-48-37(1).JPG,2
177,68,Muntiacus_reevesi,14/11/2025 20:28,14/11/2025,20:28:32,2395,39.9,0.7,0,D:/silwood/DSCF/Muntiacus_reevesi,04__2025-11-14__20-28-32(1).JPG,1
178,68,Muntiacus_reevesi,14/11/2025 22:03,14/11/2025,22:03:42,5710,95.2,1.6,0.1,D:/silwood/DSCF/Muntiacus_reevesi,04__2025-11-14__22-03-42(1).JPG,1
179,68,Muntiacus_reevesi,14/11/2025 23:38,14/11/2025,23:38:50,5708,95.1,1.6,0.1,D:/silwood/DSCF/Muntiacus_reevesi,04__2025-11-14__23-38-50(1).JPG,2
180,68,Muntiacus_reevesi,15/11/2025 05:40,15/11/2025,05:40:46,21716,361.9,6,0.2,D:/silwood/DSCF/Muntiacus_reevesi,04__2025-11-15__05-40-46(1).JPG,5
181,68,Muntiacus_reevesi,15/11/2025 06:12,15/11/2025,06:12:13,1887,31.4,0.5,0,D:/silwood/DSCF/Muntiacus_reevesi,04__2025-11-15__06-12-13(1).JPG,4
182,68,Muntiacus_reevesi,15/11/2025 07:24,15/11/2025,07:24:30,4337,72.3,1.2,0,D:/silwood/DSCF/Muntiacus_reevesi,04__2025-11-15__07-24-30(1).JPG,8
183,68,Muntiacus_reevesi,15/11/2025 09:02,15/11/2025,09:02:30,5880,98,1.6,0.1,D:/silwood/DSCF/Muntiacus_reevesi,04__2025-11-15__09-02-30(1).JPG,8
184,68,Muntiacus_reevesi,15/11/2025 11:55,15/11/2025,11:55:51,10401,173.3,2.9,0.1,D:/silwood/DSCF/Muntiacus_reevesi,04__2025-11-15__11-55-51(1).JPG,5
185,68,Muntiacus_reevesi,16/11/2025 13:37,16/11/2025,13:37:08,92477,1541.3,25.7,1.1,D:/silwood/DSCF/Muntiacus_reevesi,04__2025-11-16__13-37-08(1).JPG,4
186,68,Muntiacus_reevesi,16/11/2025 16:16,16/11/2025,16:16:05,9537,158.9,2.6,0.1,D:/silwood/DSCF/Muntiacus_reevesi,04__2025-11-16__16-16-05(1).JPG,2
187,68,Muntiacus_reevesi,16/11/2025 17:50,16/11/2025,17:50:49,5684,94.7,1.6,0.1,D:/silwood/DSCF/Muntiacus_reevesi,04__2025-11-16__17-50-49(1).JPG,2
188,68,Muntiacus_reevesi,17/11/2025 04:02,17/11/2025,04:02:59,36730,612.2,10.2,0.4,D:/silwood/DSCF/Muntiacus_reevesi,04__2025-11-17__04-02-59(1).JPG,5
189,68,Muntiacus_reevesi,17/11/2025 09:34,17/11/2025,09:34:48,19909,331.8,5.5,0.2,D:/silwood/DSCF/Muntiacus_reevesi,04__2025-11-17__09-34-48(1).JPG,1
190,68,Muntiacus_reevesi,17/11/2025 16:39,17/11/2025,16:39:40,25492,424.9,7.1,0.3,D:/silwood/DSCF/Muntiacus_reevesi,04__2025-11-17__16-39-40(1).JPG,2
191,68,Muntiacus_reevesi,17/11/2025 18:44,17/11/2025,18:44:56,7516,125.3,2.1,0.1,D:/silwood/DSCF/Muntiacus_reevesi,04__2025-11-17__18-44-56(2).JPG,5
192,68,Muntiacus_reevesi,17/11/2025 23:53,17/11/2025,23:53:29,18513,308.6,5.1,0.2,D:/silwood/DSCF/Muntiacus_reevesi,04__2025-11-17__23-53-29(1).JPG,7
193,68,Muntiacus_reevesi,18/11/2025 09:03,18/11/2025,09:03:28,32999,550,9.2,0.4,D:/silwood/DSCF/Muntiacus_reevesi,04__2025-11-18__09-03-28(1).JPG,2
194,68,Muntiacus_reevesi,18/11/2025 16:25,18/11/2025,16:25:20,26512,441.9,7.4,0.3,D:/silwood/DSCF/Muntiacus_reevesi,04__2025-11-18__16-25-20(1).JPG,1
195,68,Muntiacus_reevesi,18/11/2025 17:03,18/11/2025,17:03:41,2301,38.4,0.6,0,D:/silwood/DSCF/Muntiacus_reevesi,04__2025-11-18__17-03-41(1).JPG,1
196,68,Muntiacus_reevesi,18/11/2025 19:17,18/11/2025,19:17:08,8007,133.4,2.2,0.1,D:/silwood/DSCF/Muntiacus_reevesi,04__2025-11-18__19-17-08(1).JPG,2
197,68,Muntiacus_reevesi,18/11/2025 23:12,18/11/2025,23:12:21,14113,235.2,3.9,0.2,D:/silwood/DSCF/Muntiacus_reevesi,04__2025-11-18__23-12-21(2).JPG,1
198,68,Muntiacus_reevesi,19/11/2025 00:12,19/11/2025,00:12:31,3610,60.2,1,0,D:/silwood/DSCF/Muntiacus_reevesi,04__2025-11-19__00-12-31(1).JPG,2
199,68,Muntiacus_reevesi,19/11/2025 05:36,19/11/2025,05:36:32,19441,324,5.4,0.2,D:/silwood/DSCF/Muntiacus_reevesi,04__2025-11-19__05-36-32(1).JPG,3
200,68,Muntiacus_reevesi,19/11/2025 08:19,19/11/2025,08:19:22,9770,162.8,2.7,0.1,D:/silwood/DSCF/Muntiacus_reevesi,04__2025-11-19__08-19-22(2).JPG,6
201,68,Muntiacus_reevesi,19/11/2025 16:31,19/11/2025,16:31:15,29513,491.9,8.2,0.3,D:/silwood/DSCF/Muntiacus_reevesi,04__2025-11-19__16-31-15(1).JPG,3
202,68,Muntiacus_reevesi,19/11/2025 18:07,19/11/2025,18:07:21,5766,96.1,1.6,0.1,D:/silwood/DSCF/Muntiacus_reevesi,04__2025-11-19__18-07-21(1).JPG,2
203,68,Muntiacus_reevesi,19/11/2025 20:59,19/11/2025,20:59:19,10318,172,2.9,0.1,D:/silwood/DSCF/Muntiacus_reevesi,04__2025-11-19__20-59-19(1).JPG,1
204,68,Muntiacus_reevesi,20/11/2025 03:27,20/11/2025,03:27:12,23273,387.9,6.5,0.3,D:/silwood/DSCF/Muntiacus_reevesi,04__2025-11-20__03-27-12(2).JPG,1
205,68,Muntiacus_reevesi,20/11/2025 09:08,20/11/2025,09:08:40,20488,341.5,5.7,0.2,D:/silwood/DSCF/Muntiacus_reevesi,04__2025-11-20__09-08-40(1).JPG,5
206,68,Muntiacus_reevesi,20/11/2025 16:32,20/11/2025,16:32:10,26610,443.5,7.4,0.3,D:/silwood/DSCF/Muntiacus_reevesi,04__2025-11-20__16-32-10(1).JPG,1
207,68,Muntiacus_reevesi,20/11/2025 17:06,20/11/2025,17:06:39,2069,34.5,0.6,0,D:/silwood/DSCF/Muntiacus_reevesi,04__2025-11-20__17-06-39(1).JPG,2
208,68,Muntiacus_reevesi,20/11/2025 21:26,20/11/2025,21:26:34,15595,259.9,4.3,0.2,D:/silwood/DSCF/Muntiacus_reevesi,04__2025-11-20__21-26-34(1).JPG,2
209,68,Muntiacus_reevesi,20/11/2025 22:52,20/11/2025,22:52:30,5156,85.9,1.4,0.1,D:/silwood/DSCF/Muntiacus_reevesi,04__2025-11-20__22-52-30(1).JPG,2
210,68,Muntiacus_reevesi,21/11/2025 04:55,21/11/2025,04:55:35,21785,363.1,6.1,0.3,D:/silwood/DSCF/Muntiacus_reevesi,04__2025-11-21__04-55-35(1).JPG,5
211,68,Muntiacus_reevesi,21/11/2025 08:11,21/11/2025,08:11:08,11733,195.6,3.3,0.1,D:/silwood/DSCF/Muntiacus_reevesi,04__2025-11-21__08-11-08(1).JPG,1
212,68,Muntiacus_reevesi,21/11/2025 10:41,21/11/2025,10:41:20,9012,150.2,2.5,0.1,D:/silwood/DSCF/Muntiacus_reevesi,04__2025-11-21__10-41-20(1).JPG,2
213,68,Muntiacus_reevesi,21/11/2025 14:24,21/11/2025,14:24:34,13394,223.2,3.7,0.2,D:/silwood/DSCF/Muntiacus_reevesi,04__2025-11-21__14-24-34(1).JPG,1
214,68,Muntiacus_reevesi,21/11/2025 18:17,21/11/2025,18:17:56,14002,233.4,3.9,0.2,D:/silwood/DSCF/Muntiacus_reevesi,04__2025-11-21__18-17-56(1).JPG,2
215,68,Muntiacus_reevesi,22/11/2025 17:35,22/11/2025,17:35:20,83844,1397.4,23.3,1,D:/silwood/DSCF/Muntiacus_reevesi,04__2025-11-22__17-35-20(1).JPG,2
216,68,Muntiacus_reevesi,22/11/2025 19:01,22/11/2025,19:01:12,5152,85.9,1.4,0.1,D:/silwood/DSCF/Muntiacus_reevesi,04__2025-11-22__19-01-12(1).JPG,2
217,68,Muntiacus_reevesi,22/11/2025 20:00,22/11/2025,20:00:46,3574,59.6,1,0,D:/silwood/DSCF/Muntiacus_reevesi,04__2025-11-22__20-00-46(1).JPG,2
218,68,Muntiacus_reevesi,23/11/2025 00:04,23/11/2025,00:04:14,14608,243.5,4.1,0.2,D:/silwood/DSCF/Muntiacus_reevesi,04__2025-11-23__00-04-14(1).JPG,3
219,68,Muntiacus_reevesi,23/11/2025 03:04,23/11/2025,03:04:38,10824,180.4,3,0.1,D:/silwood/DSCF/Muntiacus_reevesi,04__2025-11-23__03-04-38(1).JPG,5
220,68,Muntiacus_reevesi,23/11/2025 10:23,23/11/2025,10:23:57,26359,439.3,7.3,0.3,D:/silwood/DSCF/Muntiacus_reevesi,04__2025-11-23__10-23-57(1).JPG,2
221,68,Muntiacus_reevesi,23/11/2025 18:05,23/11/2025,18:05:19,27682,461.4,7.7,0.3,D:/silwood/DSCF/Muntiacus_reevesi,04__2025-11-23__18-05-19(2).JPG,3
222,68,Muntiacus_reevesi,23/11/2025 23:53,23/11/2025,23:53:47,20908,348.5,5.8,0.2,D:/silwood/DSCF/Muntiacus_reevesi,04__2025-11-23__23-53-47(1).JPG,4
223,68,Muntiacus_reevesi,24/11/2025 01:24,24/11/2025,01:24:56,5469,91.2,1.5,0.1,D:/silwood/DSCF/Muntiacus_reevesi,04__2025-11-24__01-24-56(1).JPG,3
224,68,Muntiacus_reevesi,24/11/2025 05:17,24/11/2025,05:17:06,13930,232.2,3.9,0.2,D:/silwood/DSCF/Muntiacus_reevesi,04__2025-11-24__05-17-06(1).JPG,1
225,68,Oryctolagus_cuniculus,08/10/2025 23:19,08/10/2025,23:19:08,0,0,0,0,D:/silwood/DSCF/Oryctolagus_cuniculus,04__2025-10-08__23-19-08(1).JPG,2
226,68,Oryctolagus_cuniculus,09/10/2025 03:00,09/10/2025,03:00:18,13270,221.2,3.7,0.2,D:/silwood/DSCF/Oryctolagus_cuniculus,04__2025-10-09__03-00-18(1).JPG,4
227,68,Oryctolagus_cuniculus,10/10/2025 07:04,10/10/2025,07:04:20,101042,1684,28.1,1.2,D:/silwood/DSCF/Oryctolagus_cuniculus,04__2025-10-10__07-04-20(1).JPG,1
228,68,Oryctolagus_cuniculus,10/10/2025 19:02,10/10/2025,19:02:41,43101,718.4,12,0.5,D:/silwood/DSCF/Oryctolagus_cuniculus,04__2025-10-10__19-02-41(1).JPG,1
229,68,Oryctolagus_cuniculus,10/10/2025 22:23,10/10/2025,22:23:12,12031,200.5,3.3,0.1,D:/silwood/DSCF/Oryctolagus_cuniculus,04__2025-10-10__22-23-12(1).JPG,3
230,68,Oryctolagus_cuniculus,11/10/2025 03:59,11/10/2025,03:59:23,20171,336.2,5.6,0.2,D:/silwood/DSCF/Oryctolagus_cuniculus,04__2025-10-11__03-59-23(1).JPG,4
231,68,Oryctolagus_cuniculus,11/10/2025 04:49,11/10/2025,04:49:46,3023,50.4,0.8,0,D:/silwood/DSCF/Oryctolagus_cuniculus,04__2025-10-11__04-49-46(1).JPG,2
232,68,Oryctolagus_cuniculus,12/10/2025 01:05,12/10/2025,01:05:45,72959,1216,20.3,0.8,D:/silwood/DSCF/Oryctolagus_cuniculus,04__2025-10-12__01-05-45(1).JPG,2
233,68,Oryctolagus_cuniculus,12/10/2025 01:55,12/10/2025,01:55:08,2963,49.4,0.8,0,D:/silwood/DSCF/Oryctolagus_cuniculus,04__2025-10-12__01-55-08(1).JPG,2
234,68,Oryctolagus_cuniculus,13/10/2025 22:26,13/10/2025,22:26:04,160256,2670.9,44.5,1.9,D:/silwood/DSCF/Oryctolagus_cuniculus,04__2025-10-13__22-26-04(1).JPG,1
235,68,Oryctolagus_cuniculus,14/10/2025 02:39,14/10/2025,02:39:59,15235,253.9,4.2,0.2,D:/silwood/DSCF/Oryctolagus_cuniculus,04__2025-10-14__02-39-59(1).JPG,3
236,68,Oryctolagus_cuniculus,14/10/2025 03:49,14/10/2025,03:49:52,4193,69.9,1.2,0,D:/silwood/DSCF/Oryctolagus_cuniculus,04__2025-10-14__03-49-52(1).JPG,1
237,68,Oryctolagus_cuniculus,14/10/2025 04:34,14/10/2025,04:34:34,2682,44.7,0.7,0,D:/silwood/DSCF/Oryctolagus_cuniculus,04__2025-10-14__04-34-34(1).JPG,3
238,68,Oryctolagus_cuniculus,15/10/2025 03:32,15/10/2025,03:32:34,82680,1378,23,1,D:/silwood/DSCF/Oryctolagus_cuniculus,04__2025-10-15__03-32-34(1).JPG,1
239,68,Oryctolagus_cuniculus,15/10/2025 05:38,15/10/2025,05:38:46,7572,126.2,2.1,0.1,D:/silwood/DSCF/Oryctolagus_cuniculus,04__2025-10-15__05-38-46(1).JPG,2
240,68,Oryctolagus_cuniculus,15/10/2025 20:24,15/10/2025,20:24:13,53127,885.5,14.8,0.6,D:/silwood/DSCF/Oryctolagus_cuniculus,04__2025-10-15__20-24-13(1).JPG,2
241,68,Oryctolagus_cuniculus,16/10/2025 21:09,16/10/2025,21:09:54,89141,1485.7,24.8,1,D:/silwood/DSCF/Oryctolagus_cuniculus,04__2025-10-16__21-09-54(1).JPG,2
242,68,Oryctolagus_cuniculus,16/10/2025 22:35,16/10/2025,22:35:14,5120,85.3,1.4,0.1,D:/silwood/DSCF/Oryctolagus_cuniculus,04__2025-10-16__22-35-14(1).JPG,6
243,68,Oryctolagus_cuniculus,16/10/2025 23:17,16/10/2025,23:17:24,2530,42.2,0.7,0,D:/silwood/DSCF/Oryctolagus_cuniculus,04__2025-10-16__23-17-24(1).JPG,6
244,68,Oryctolagus_cuniculus,17/10/2025 23:34,17/10/2025,23:34:37,87433,1457.2,24.3,1,D:/silwood/DSCF/Oryctolagus_cuniculus,04__2025-10-17__23-34-37(1).JPG,1
245,68,Oryctolagus_cuniculus,19/10/2025 02:33,19/10/2025,02:33:58,97161,1619.3,27,1.1,D:/silwood/DSCF/Oryctolagus_cuniculus,04__2025-10-19__02-33-58(1).JPG,5
246,68,Oryctolagus_cuniculus,20/10/2025 01:41,20/10/2025,01:41:45,83267,1387.8,23.1,1,D:/silwood/DSCF/Oryctolagus_cuniculus,04__2025-10-20__01-41-45(1).JPG,8
247,68,Oryctolagus_cuniculus,20/10/2025 03:47,20/10/2025,03:47:23,7538,125.6,2.1,0.1,D:/silwood/DSCF/Oryctolagus_cuniculus,04__2025-10-20__03-47-23(1).JPG,2
248,68,Oryctolagus_cuniculus,20/10/2025 05:15,20/10/2025,05:15:21,5278,88,1.5,0.1,D:/silwood/DSCF/Oryctolagus_cuniculus,04__2025-10-20__05-15-21(1).JPG,1
249,68,Oryctolagus_cuniculus,21/10/2025 23:58,21/10/2025,23:58:15,153774,2562.9,42.7,1.8,D:/silwood/DSCF/Oryctolagus_cuniculus,04__2025-10-21__23-58-15(1).JPG,3
250,68,Oryctolagus_cuniculus,22/10/2025 01:54,22/10/2025,01:54:35,6980,116.3,1.9,0.1,D:/silwood/DSCF/Oryctolagus_cuniculus,04__2025-10-22__01-54-35(1).JPG,1
251,68,Oryctolagus_cuniculus,22/10/2025 02:43,22/10/2025,02:43:41,2946,49.1,0.8,0,D:/silwood/DSCF/Oryctolagus_cuniculus,04__2025-10-22__02-43-41(1).JPG,4
252,68,Oryctolagus_cuniculus,22/10/2025 04:46,22/10/2025,04:46:10,7349,122.5,2,0.1,D:/silwood/DSCF/Oryctolagus_cuniculus,04__2025-10-22__04-46-10(1).JPG,3
253,68,Oryctolagus_cuniculus,22/10/2025 06:06,22/10/2025,06:06:46,4836,80.6,1.3,0.1,D:/silwood/DSCF/Oryctolagus_cuniculus,04__2025-10-22__06-06-46(1).JPG,2
254,68,Oryctolagus_cuniculus,24/10/2025 02:56,24/10/2025,02:56:12,161366,2689.4,44.8,1.9,D:/silwood/DSCF/Oryctolagus_cuniculus,04__2025-10-24__02-56-12(1).JPG,3
255,68,Oryctolagus_cuniculus,24/10/2025 22:12,24/10/2025,22:12:08,69356,1155.9,19.3,0.8,D:/silwood/DSCF/Oryctolagus_cuniculus,04__2025-10-24__22-12-08(1).JPG,1
256,68,Oryctolagus_cuniculus,25/10/2025 05:19,25/10/2025,05:19:13,25625,427.1,7.1,0.3,D:/silwood/DSCF/Oryctolagus_cuniculus,04__2025-10-25__05-19-13(1).JPG,1
257,68,Oryctolagus_cuniculus,25/10/2025 19:10,25/10/2025,19:10:06,49853,830.9,13.8,0.6,D:/silwood/DSCF/Oryctolagus_cuniculus,04__2025-10-25__19-10-06(1).JPG,1
258,68,Oryctolagus_cuniculus,25/10/2025 20:34,25/10/2025,20:34:40,5074,84.6,1.4,0.1,D:/silwood/DSCF/Oryctolagus_cuniculus,04__2025-10-25__20-34-40(1).JPG,1
259,68,Oryctolagus_cuniculus,27/10/2025 05:30,27/10/2025,05:30:48,118568,1976.1,32.9,1.4,D:/silwood/DSCF/Oryctolagus_cuniculus,04__2025-10-27__05-30-48(1).JPG,1
260,68,Oryctolagus_cuniculus,27/10/2025 07:00,27/10/2025,07:00:19,5371,89.5,1.5,0.1,D:/silwood/DSCF/Oryctolagus_cuniculus,04__2025-10-27__07-00-19(2).JPG,1
261,68,Oryctolagus_cuniculus,29/10/2025 18:41,29/10/2025,18:41:59,214900,3581.7,59.7,2.5,D:/silwood/DSCF/Oryctolagus_cuniculus,04__2025-10-29__18-41-59(1).JPG,1
262,68,Oryctolagus_cuniculus,29/10/2025 20:21,29/10/2025,20:21:24,5965,99.4,1.7,0.1,D:/silwood/DSCF/Oryctolagus_cuniculus,04__2025-10-29__20-21-24(1).JPG,2
263,68,Oryctolagus_cuniculus,30/10/2025 01:18,30/10/2025,01:18:33,17829,297.1,5,0.2,D:/silwood/DSCF/Oryctolagus_cuniculus,04__2025-10-30__01-18-33(2).JPG,1
264,68,Oryctolagus_cuniculus,30/10/2025 04:04,30/10/2025,04:04:51,9978,166.3,2.8,0.1,D:/silwood/DSCF/Oryctolagus_cuniculus,04__2025-10-30__04-04-51(1).JPG,1
265,68,Oryctolagus_cuniculus,30/10/2025 04:43,30/10/2025,04:43:06,2295,38.2,0.6,0,D:/silwood/DSCF/Oryctolagus_cuniculus,04__2025-10-30__04-43-06(1).JPG,3
266,68,Oryctolagus_cuniculus,30/10/2025 05:17,30/10/2025,05:17:42,2076,34.6,0.6,0,D:/silwood/DSCF/Oryctolagus_cuniculus,04__2025-10-30__05-17-42(1).JPG,2
267,68,Oryctolagus_cuniculus,30/10/2025 06:06,30/10/2025,06:06:00,2898,48.3,0.8,0,D:/silwood/DSCF/Oryctolagus_cuniculus,04__2025-10-30__06-06-00(1).JPG,1
268,68,Oryctolagus_cuniculus,30/10/2025 07:26,30/10/2025,07:26:16,4816,80.3,1.3,0.1,D:/silwood/DSCF/Oryctolagus_cuniculus,04__2025-10-30__07-26-16(1).JPG,1
269,68,Oryctolagus_cuniculus,30/10/2025 18:37,30/10/2025,18:37:03,40247,670.8,11.2,0.5,D:/silwood/DSCF/Oryctolagus_cuniculus,04__2025-10-30__18-37-03(1).JPG,2
270,68,Oryctolagus_cuniculus,30/10/2025 19:25,30/10/2025,19:25:27,2904,48.4,0.8,0,D:/silwood/DSCF/Oryctolagus_cuniculus,04__2025-10-30__19-25-27(1).JPG,1
271,68,Oryctolagus_cuniculus,30/10/2025 20:57,30/10/2025,20:57:43,5536,92.3,1.5,0.1,D:/silwood/DSCF/Oryctolagus_cuniculus,04__2025-10-30__20-57-43(1).JPG,1
272,68,Oryctolagus_cuniculus,01/11/2025 22:54,01/11/2025,22:54:11,179788,2996.5,49.9,2.1,D:/silwood/DSCF/Oryctolagus_cuniculus,04__2025-11-01__22-54-11(1).JPG,1
273,68,Oryctolagus_cuniculus,01/11/2025 23:42,01/11/2025,23:42:14,2883,48,0.8,0,D:/silwood/DSCF/Oryctolagus_cuniculus,04__2025-11-01__23-42-14(1).JPG,1
274,68,Oryctolagus_cuniculus,02/11/2025 00:43,02/11/2025,00:43:15,3661,61,1,0,D:/silwood/DSCF/Oryctolagus_cuniculus,04__2025-11-02__00-43-15(1).JPG,9
275,68,Oryctolagus_cuniculus,02/11/2025 04:12,02/11/2025,04:12:51,12576,209.6,3.5,0.1,D:/silwood/DSCF/Oryctolagus_cuniculus,04__2025-11-02__04-12-51(1).JPG,3
276,68,Oryctolagus_cuniculus,02/11/2025 04:48,02/11/2025,04:48:16,2125,35.4,0.6,0,D:/silwood/DSCF/Oryctolagus_cuniculus,04__2025-11-02__04-48-16(1).JPG,1
277,68,Oryctolagus_cuniculus,02/11/2025 18:37,02/11/2025,18:37:08,49732,828.9,13.8,0.6,D:/silwood/DSCF/Oryctolagus_cuniculus,04__2025-11-02__18-37-08(1).JPG,4
278,68,Oryctolagus_cuniculus,03/11/2025 02:43,03/11/2025,02:43:24,29176,486.3,8.1,0.3,D:/silwood/DSCF/Oryctolagus_cuniculus,04__2025-11-03__02-43-24(1).JPG,2
279,68,Oryctolagus_cuniculus,03/11/2025 19:37,03/11/2025,19:37:28,60844,1014.1,16.9,0.7,D:/silwood/DSCF/Oryctolagus_cuniculus,04__2025-11-03__19-37-28(1).JPG,3
280,68,Oryctolagus_cuniculus,04/11/2025 04:04,04/11/2025,04:04:16,30408,506.8,8.4,0.4,D:/silwood/DSCF/Oryctolagus_cuniculus,04__2025-11-04__04-04-16(1).JPG,1
281,68,Oryctolagus_cuniculus,04/11/2025 18:35,04/11/2025,18:35:19,52263,871,14.5,0.6,D:/silwood/DSCF/Oryctolagus_cuniculus,04__2025-11-04__18-35-19(1).JPG,1
282,68,Oryctolagus_cuniculus,05/11/2025 02:55,05/11/2025,02:55:37,30018,500.3,8.3,0.3,D:/silwood/DSCF/Oryctolagus_cuniculus,04__2025-11-05__02-55-37(1).JPG,2
283,68,Oryctolagus_cuniculus,05/11/2025 06:55,05/11/2025,06:55:19,14382,239.7,4,0.2,D:/silwood/DSCF/Oryctolagus_cuniculus,04__2025-11-05__06-55-19(2).JPG,1
284,68,Oryctolagus_cuniculus,07/11/2025 06:53,07/11/2025,06:53:07,172668,2877.8,48,2,D:/silwood/DSCF/Oryctolagus_cuniculus,04__2025-11-07__06-53-07(1).JPG,1
285,68,Oryctolagus_cuniculus,08/11/2025 04:26,08/11/2025,04:26:41,77614,1293.6,21.6,0.9,D:/silwood/DSCF/Oryctolagus_cuniculus,04__2025-11-08__04-26-41(1).JPG,2
286,68,Oryctolagus_cuniculus,08/11/2025 07:29,08/11/2025,07:29:23,10962,182.7,3,0.1,D:/silwood/DSCF/Oryctolagus_cuniculus,04__2025-11-08__07-29-23(1).JPG,2
287,68,Oryctolagus_cuniculus,08/11/2025 20:15,08/11/2025,20:15:16,45953,765.9,12.8,0.5,D:/silwood/DSCF/Oryctolagus_cuniculus,04__2025-11-08__20-15-16(1).JPG,1
288,68,Oryctolagus_cuniculus,08/11/2025 23:43,08/11/2025,23:43:38,12502,208.4,3.5,0.1,D:/silwood/DSCF/Oryctolagus_cuniculus,04__2025-11-08__23-43-38(1).JPG,1
289,68,Oryctolagus_cuniculus,09/11/2025 03:26,09/11/2025,03:26:28,13370,222.8,3.7,0.2,D:/silwood/DSCF/Oryctolagus_cuniculus,04__2025-11-09__03-26-28(1).JPG,1
290,68,Oryctolagus_cuniculus,09/11/2025 07:21,09/11/2025,07:21:49,14121,235.3,3.9,0.2,D:/silwood/DSCF/Oryctolagus_cuniculus,04__2025-11-09__07-21-49(1).JPG,3
291,68,Oryctolagus_cuniculus,11/11/2025 01:12,11/11/2025,01:12:23,150634,2510.6,41.8,1.7,D:/silwood/DSCF/Oryctolagus_cuniculus,04__2025-11-11__01-12-23(1).JPG,2
292,68,Oryctolagus_cuniculus,11/11/2025 03:09,11/11/2025,03:09:25,7022,117,2,0.1,D:/silwood/DSCF/Oryctolagus_cuniculus,04__2025-11-11__03-09-25(1).JPG,2
293,68,Oryctolagus_cuniculus,11/11/2025 05:55,11/11/2025,05:55:07,9942,165.7,2.8,0.1,D:/silwood/DSCF/Oryctolagus_cuniculus,04__2025-11-11__05-55-07(1).JPG,2
294,68,Oryctolagus_cuniculus,11/11/2025 19:27,11/11/2025,19:27:49,48762,812.7,13.5,0.6,D:/silwood/DSCF/Oryctolagus_cuniculus,04__2025-11-11__19-27-49(1).JPG,2
295,68,Oryctolagus_cuniculus,12/11/2025 03:59,12/11/2025,03:59:25,30696,511.6,8.5,0.4,D:/silwood/DSCF/Oryctolagus_cuniculus,04__2025-11-12__03-59-25(1).JPG,1
296,68,Oryctolagus_cuniculus,12/11/2025 19:05,12/11/2025,19:05:00,54335,905.6,15.1,0.6,D:/silwood/DSCF/Oryctolagus_cuniculus,04__2025-11-12__19-05-00(1).JPG,1
297,68,Oryctolagus_cuniculus,12/11/2025 21:10,12/11/2025,21:10:46,7546,125.8,2.1,0.1,D:/silwood/DSCF/Oryctolagus_cuniculus,04__2025-11-12__21-10-46(1).JPG,1
298,68,Oryctolagus_cuniculus,13/11/2025 02:12,13/11/2025,02:12:06,18080,301.3,5,0.2,D:/silwood/DSCF/Oryctolagus_cuniculus,04__2025-11-13__02-12-06(1).JPG,4
299,68,Oryctolagus_cuniculus,13/11/2025 07:23,13/11/2025,07:23:18,18672,311.2,5.2,0.2,D:/silwood/DSCF/Oryctolagus_cuniculus,04__2025-11-13__07-23-18(1).JPG,2
300,68,Oryctolagus_cuniculus,14/11/2025 01:43,14/11/2025,01:43:32,66014,1100.2,18.3,0.8,D:/silwood/DSCF/Oryctolagus_cuniculus,04__2025-11-14__01-43-32(1).JPG,2
301,68,Oryctolagus_cuniculus,14/11/2025 04:03,14/11/2025,04:03:32,8400,140,2.3,0.1,D:/silwood/DSCF/Oryctolagus_cuniculus,04__2025-11-14__04-03-32(1).JPG,1
302,68,Oryctolagus_cuniculus,15/11/2025 07:41,15/11/2025,07:41:47,99495,1658.2,27.6,1.2,D:/silwood/DSCF/Oryctolagus_cuniculus,04__2025-11-15__07-41-47(1).JPG,1
303,68,Oryctolagus_cuniculus,15/11/2025 18:12,15/11/2025,18:12:16,37829,630.5,10.5,0.4,D:/silwood/DSCF/Oryctolagus_cuniculus,04__2025-11-15__18-12-16(1).JPG,1
304,68,Oryctolagus_cuniculus,16/11/2025 04:17,16/11/2025,04:17:01,36285,604.8,10.1,0.4,D:/silwood/DSCF/Oryctolagus_cuniculus,04__2025-11-16__04-17-01(1).JPG,1
305,68,Oryctolagus_cuniculus,16/11/2025 05:29,16/11/2025,05:29:49,4368,72.8,1.2,0,D:/silwood/DSCF/Oryctolagus_cuniculus,04__2025-11-16__05-29-49(1).JPG,1
306,68,Oryctolagus_cuniculus,18/11/2025 02:14,18/11/2025,02:14:08,161059,2684.3,44.7,1.9,D:/silwood/DSCF/Oryctolagus_cuniculus,04__2025-11-18__02-14-08(1).JPG,1
307,68,Oryctolagus_cuniculus,18/11/2025 07:44,18/11/2025,07:44:55,19847,330.8,5.5,0.2,D:/silwood/DSCF/Oryctolagus_cuniculus,04__2025-11-18__07-44-55(1).JPG,2
308,68,Oryctolagus_cuniculus,19/11/2025 20:59,19/11/2025,20:59:20,134065,2234.4,37.2,1.6,D:/silwood/DSCF/Oryctolagus_cuniculus,04__2025-11-19__20-59-20(2).JPG,1
309,68,Oryctolagus_cuniculus,20/11/2025 03:27,20/11/2025,03:27:11,23271,387.9,6.5,0.3,D:/silwood/DSCF/Oryctolagus_cuniculus,04__2025-11-20__03-27-11(1).JPG,1
310,68,Oryctolagus_cuniculus,21/11/2025 05:32,21/11/2025,05:32:12,93901,1565,26.1,1.1,D:/silwood/DSCF/Oryctolagus_cuniculus,04__2025-11-21__05-32-12(1).JPG,1
311,68,Oryctolagus_cuniculus,21/11/2025 17:56,21/11/2025,17:56:25,44653,744.2,12.4,0.5,D:/silwood/DSCF/Oryctolagus_cuniculus,04__2025-11-21__17-56-25(1).JPG,2
312,68,Oryctolagus_cuniculus,21/11/2025 23:45,21/11/2025,23:45:40,20955,349.2,5.8,0.2,D:/silwood/DSCF/Oryctolagus_cuniculus,04__2025-11-21__23-45-40(1).JPG,2
313,68,Oryctolagus_cuniculus,22/11/2025 05:42,22/11/2025,05:42:53,21433,357.2,6,0.2,D:/silwood/DSCF/Oryctolagus_cuniculus,04__2025-11-22__05-42-53(1).JPG,1
314,68,Oryctolagus_cuniculus,23/11/2025 00:42,23/11/2025,00:42:24,68371,1139.5,19,0.8,D:/silwood/DSCF/Oryctolagus_cuniculus,04__2025-11-23__00-42-24(1).JPG,2
315,68,Oryctolagus_cuniculus,23/11/2025 01:26,23/11/2025,01:26:45,2661,44.4,0.7,0,D:/silwood/DSCF/Oryctolagus_cuniculus,04__2025-11-23__01-26-45(1).JPG,1
316,68,Phasianus_colchicus,01/11/2025 16:57,01/11/2025,16:57:46,0,0,0,0,D:/silwood/DSCF/Phasianus_colchicus,04__2025-11-01__16-57-46(1).JPG,3
317,68,Sciurus_carolinensis,09/10/2025 08:09,09/10/2025,08:09:58,0,0,0,0,D:/silwood/DSCF/Sciurus_carolinensis,04__2025-10-09__08-09-58(1).JPG,2
318,68,Sciurus_carolinensis,12/10/2025 15:49,12/10/2025,15:49:56,286798,4780,79.7,3.3,D:/silwood/DSCF/Sciurus_carolinensis,04__2025-10-12__15-49-56(1).JPG,1
319,68,Sciurus_carolinensis,20/10/2025 17:01,20/10/2025,17:01:09,695473,11591.2,193.2,8,D:/silwood/DSCF/Sciurus_carolinensis,04__2025-10-20__17-01-09(1).JPG,1
320,68,Sciurus_carolinensis,22/10/2025 13:55,22/10/2025,13:55:16,161647,2694.1,44.9,1.9,D:/silwood/DSCF/Sciurus_carolinensis,04__2025-10-22__13-55-16(1).JPG,1
321,68,Sciurus_carolinensis,24/10/2025 07:52,24/10/2025,07:52:33,151037,2517.3,42,1.8,D:/silwood/DSCF/Sciurus_carolinensis,04__2025-10-24__07-52-33(2).JPG,2
322,68,Sciurus_carolinensis,30/10/2025 10:47,30/10/2025,10:47:21,528888,8814.8,146.9,6.1,D:/silwood/DSCF/Sciurus_carolinensis,04__2025-10-30__10-47-21(1).JPG,5
323,68,Sciurus_carolinensis,31/10/2025 08:40,31/10/2025,08:40:39,78798,1313.3,21.9,0.9,D:/silwood/DSCF/Sciurus_carolinensis,04__2025-10-31__08-40-39(1).JPG,2
324,68,Sciurus_carolinensis,02/11/2025 10:09,02/11/2025,10:09:51,178152,2969.2,49.5,2.1,D:/silwood/DSCF/Sciurus_carolinensis,04__2025-11-02__10-09-51(1).JPG,3
325,68,Sciurus_carolinensis,04/11/2025 17:36,04/11/2025,17:36:09,199578,3326.3,55.4,2.3,D:/silwood/DSCF/Sciurus_carolinensis,04__2025-11-04__17-36-09(1).JPG,2
326,68,Sciurus_carolinensis,06/11/2025 14:59,06/11/2025,14:59:19,163390,2723.2,45.4,1.9,D:/silwood/DSCF/Sciurus_carolinensis,04__2025-11-06__14-59-19(1).JPG,1
327,68,Sciurus_carolinensis,08/11/2025 08:47,08/11/2025,08:47:21,150482,2508,41.8,1.7,D:/silwood/DSCF/Sciurus_carolinensis,04__2025-11-08__08-47-21(1).JPG,1
328,68,Sciurus_carolinensis,08/11/2025 17:16,08/11/2025,17:16:40,30559,509.3,8.5,0.4,D:/silwood/DSCF/Sciurus_carolinensis,04__2025-11-08__17-16-40(1).JPG,1
329,68,Sciurus_carolinensis,12/11/2025 08:28,12/11/2025,08:28:43,313923,5232,87.2,3.6,D:/silwood/DSCF/Sciurus_carolinensis,04__2025-11-12__08-28-43(1).JPG,3
330,68,Sciurus_carolinensis,13/11/2025 08:18,13/11/2025,08:18:34,85791,1429.8,23.8,1,D:/silwood/DSCF/Sciurus_carolinensis,04__2025-11-13__08-18-34(1).JPG,1
331,68,Sciurus_carolinensis,13/11/2025 09:59,13/11/2025,09:59:12,6038,100.6,1.7,0.1,D:/silwood/DSCF/Sciurus_carolinensis,04__2025-11-13__09-59-12(1).JPG,2
332,68,Sciurus_carolinensis,13/11/2025 13:57,13/11/2025,13:57:01,14269,237.8,4,0.2,D:/silwood/DSCF/Sciurus_carolinensis,04__2025-11-13__13-57-01(1).JPG,2
333,68,Sciurus_carolinensis,13/11/2025 15:29,13/11/2025,15:29:18,5537,92.3,1.5,0.1,D:/silwood/DSCF/Sciurus_carolinensis,04__2025-11-13__15-29-18(1).JPG,3
334,68,Sciurus_carolinensis,15/11/2025 08:16,15/11/2025,08:16:16,146818,2447,40.8,1.7,D:/silwood/DSCF/Sciurus_carolinensis,04__2025-11-15__08-16-16(1).JPG,2
335,68,Sciurus_carolinensis,17/11/2025 16:39,17/11/2025,16:39:40,203004,3383.4,56.4,2.4,D:/silwood/DSCF/Sciurus_carolinensis,04__2025-11-17__16-39-40(1) copy.JPG,5
336,68,Sciurus_carolinensis,21/11/2025 14:50,21/11/2025,14:50:43,339063,5651,94.2,3.9,D:/silwood/DSCF/Sciurus_carolinensis,04__2025-11-21__14-50-43(1).JPG,4
337,68,Sciurus_carolinensis,21/11/2025 15:31,21/11/2025,15:31:54,2471,41.2,0.7,0,D:/silwood/DSCF/Sciurus_carolinensis,04__2025-11-21__15-31-54(1).JPG,1
338,68,Sciurus_carolinensis,21/11/2025 17:15,21/11/2025,17:15:56,6242,104,1.7,0.1,D:/silwood/DSCF/Sciurus_carolinensis,04__2025-11-21__17-15-56(1).JPG,2
339,68,Vulpes_vulpes,09/10/2025 06:55,09/10/2025,06:55:41,0,0,0,0,D:/silwood/DSCF/Vulpes_vulpes,04__2025-10-09__06-55-41(1).JPG,2
340,68,Vulpes_vulpes,10/10/2025 02:36,10/10/2025,02:36:38,70857,1181,19.7,0.8,D:/silwood/DSCF/Vulpes_vulpes,04__2025-10-10__02-36-38(1).JPG,1
341,68,Vulpes_vulpes,12/10/2025 21:04,12/10/2025,21:04:24,239266,3987.8,66.5,2.8,D:/silwood/DSCF/Vulpes_vulpes,04__2025-10-12__21-04-24(1).JPG,1
342,68,Vulpes_vulpes,13/10/2025 07:00,13/10/2025,07:00:12,35748,595.8,9.9,0.4,D:/silwood/DSCF/Vulpes_vulpes,04__2025-10-13__07-00-12(1).JPG,1
343,68,Vulpes_vulpes,13/10/2025 18:49,13/10/2025,18:49:43,42571,709.5,11.8,0.5,D:/silwood/DSCF/Vulpes_vulpes,04__2025-10-13__18-49-43(1).JPG,2
344,68,Vulpes_vulpes,14/10/2025 18:46,14/10/2025,18:46:19,86196,1436.6,23.9,1,D:/silwood/DSCF/Vulpes_vulpes,04__2025-10-14__18-46-19(1).JPG,2
345,68,Vulpes_vulpes,15/10/2025 06:58,15/10/2025,06:58:38,43939,732.3,12.2,0.5,D:/silwood/DSCF/Vulpes_vulpes,04__2025-10-15__06-58-38(1).JPG,1
346,68,Vulpes_vulpes,15/10/2025 07:33,15/10/2025,07:33:17,2079,34.6,0.6,0,D:/silwood/DSCF/Vulpes_vulpes,04__2025-10-15__07-33-17(1).JPG,1
347,68,Vulpes_vulpes,15/10/2025 18:49,15/10/2025,18:49:29,40572,676.2,11.3,0.5,D:/silwood/DSCF/Vulpes_vulpes,04__2025-10-15__18-49-29(1).JPG,2
348,68,Vulpes_vulpes,16/10/2025 19:55,16/10/2025,19:55:07,90338,1505.6,25.1,1,D:/silwood/DSCF/Vulpes_vulpes,04__2025-10-16__19-55-07(1).JPG,2
349,68,Vulpes_vulpes,17/10/2025 05:31,17/10/2025,05:31:56,34609,576.8,9.6,0.4,D:/silwood/DSCF/Vulpes_vulpes,04__2025-10-17__05-31-56(1).JPG,1
350,68,Vulpes_vulpes,17/10/2025 18:42,17/10/2025,18:42:40,47444,790.7,13.2,0.5,D:/silwood/DSCF/Vulpes_vulpes,04__2025-10-17__18-42-40(1).JPG,2
351,68,Vulpes_vulpes,20/10/2025 03:33,20/10/2025,03:33:44,204664,3411.1,56.9,2.4,D:/silwood/DSCF/Vulpes_vulpes,04__2025-10-20__03-33-44(1).JPG,1
352,68,Vulpes_vulpes,20/10/2025 06:52,20/10/2025,06:52:11,11907,198.4,3.3,0.1,D:/silwood/DSCF/Vulpes_vulpes,04__2025-10-20__06-52-11(1).JPG,1
353,68,Vulpes_vulpes,21/10/2025 07:00,21/10/2025,07:00:19,86888,1448.1,24.1,1,D:/silwood/DSCF/Vulpes_vulpes,04__2025-10-21__07-00-19(1).JPG,2
354,68,Vulpes_vulpes,24/10/2025 18:45,24/10/2025,18:45:35,301516,5025.3,83.8,3.5,D:/silwood/DSCF/Vulpes_vulpes,04__2025-10-24__18-45-35(1).JPG,1
355,68,Vulpes_vulpes,25/10/2025 19:24,25/10/2025,19:24:52,88757,1479.3,24.7,1,D:/silwood/DSCF/Vulpes_vulpes,04__2025-10-25__19-24-52(1).JPG,2
356,68,Vulpes_vulpes,30/10/2025 18:42,30/10/2025,18:42:06,429434,7157.2,119.3,5,D:/silwood/DSCF/Vulpes_vulpes,04__2025-10-30__18-42-06(1).JPG,2
357,68,Vulpes_vulpes,30/10/2025 23:46,30/10/2025,23:46:34,18268,304.5,5.1,0.2,D:/silwood/DSCF/Vulpes_vulpes,04__2025-10-30__23-46-34(2).JPG,2
358,68,Vulpes_vulpes,31/10/2025 08:50,31/10/2025,08:50:28,32634,543.9,9.1,0.4,D:/silwood/DSCF/Vulpes_vulpes,04__2025-10-31__08-50-28(1).JPG,2
359,68,Vulpes_vulpes,31/10/2025 09:21,31/10/2025,09:21:15,1847,30.8,0.5,0,D:/silwood/DSCF/Vulpes_vulpes,04__2025-10-31__09-21-15(1).JPG,1
360,68,Vulpes_vulpes,31/10/2025 20:12,31/10/2025,20:12:33,39078,651.3,10.9,0.5,D:/silwood/DSCF/Vulpes_vulpes,04__2025-10-31__20-12-33(1).JPG,1
361,68,Vulpes_vulpes,02/11/2025 05:47,02/11/2025,05:47:51,120918,2015.3,33.6,1.4,D:/silwood/DSCF/Vulpes_vulpes,04__2025-11-02__05-47-51(1).JPG,1
362,68,Vulpes_vulpes,06/11/2025 18:01,06/11/2025,18:01:46,389635,6493.9,108.2,4.5,D:/silwood/DSCF/Vulpes_vulpes,04__2025-11-06__18-01-46(1).JPG,1
363,68,Vulpes_vulpes,18/11/2025 07:31,18/11/2025,07:31:46,999000,16650,277.5,11.6,D:/silwood/DSCF/Vulpes_vulpes,04__2025-11-18__07-31-46(1).JPG,1
364,68,Vulpes_vulpes,20/11/2025 05:18,20/11/2025,05:18:34,164808,2746.8,45.8,1.9,D:/silwood/DSCF/Vulpes_vulpes,04__2025-11-20__05-18-34(1).JPG,1